{
  "$schema": "../schema/product-profile.schema.json",
  "productProfileId": "example-semaglutide-5mg",
  "productCategory": "PEPTIDE",
  "peptideName": "SEMAGLUTIDE",
  "strength": "5MG",
  "descriptor": "PURE PEPTIDE",
  "concentration": "2MG/ML",
  "vialSize": "2.5ML VIAL",
  "purityClaim": "≥99% PURITY",
  "labTestedClaim": "LAB TESTED",
  "lot": "SC010125",
  "ubd": "01/2027",
  "coaQrDestination": "https://example.com/coa/SC010125",
  "coaUrl": "coa.example.com/SC010125"
}
