{
  "$schema": "../../schema/product-profile.schema.json",
  "productProfileId": "example-brand-2-tirzepatide-10mg",
  "productCategory": "PEPTIDE",
  "peptideName": "TIRZEPATIDE",
  "strength": "10MG",
  "descriptor": "PURE PEPTIDE",
  "concentration": "5MG/ML",
  "vialSize": "2ML VIAL",
  "purityClaim": "≥99% PURITY",
  "labTestedClaim": "LAB TESTED",
  "lot": "EB2020225",
  "ubd": "02/2027",
  "coaQrDestination": "https://example.com/coa/EB2020225",
  "coaUrl": "coa.example.com/EB2020225"
}
