{
  "$schema": "../../schema/product-profile.schema.json",
  "productProfileId": "example-brand-1-bpc157-5mg",
  "productCategory": "PEPTIDE",
  "peptideName": "BPC-157",
  "strength": "5MG",
  "descriptor": "PURE PEPTIDE",
  "concentration": "2MG/ML",
  "vialSize": "2.5ML VIAL",
  "purityClaim": "≥99% PURITY",
  "labTestedClaim": "LAB TESTED",
  "lot": "EB1010125",
  "ubd": "01/2027",
  "coaQrDestination": "https://example.com/coa/EB1010125",
  "coaUrl": "coa.example.com/EB1010125"
}
